ID000001,小脇拓哉,小脇です。お腹すいた。。。。ご飯食べたい。。。今日は一蘭でもいくか。。。,2024-06-20 15:37:55,667430b31f7d5.jpeg,レイヤー 2_2.png
ID000002,おれはなみまつだ,俺が並松だぞ！この絵を見ろ！！！！,2024-06-20 15:40:27,6674314ba46f9.jpg,nami__2.png
ID000003,宮本武蔵,私は宮本武蔵。あの有名な宮本武蔵です。有名な著書は五輪書です。,2024-06-20 17:49:05,66744f713bb29.jpg,musashi_2.png
ID000004,佐々木小次郎,実はタバコ吸ってます。。。。この写真はカッコよく撮影してみました。。。,2024-06-20 17:51:34,6674500620b97.jpg,68152931_1.webp
ID000004,佐々木小次郎,合成してこんなのも作りましたよ！,2024-06-20 17:53:41,667450856934f.jpg,68152931_1.webp
,,てすとてすと,2024-06-28 20:37:16,667f02dc9e02d.jpg,
